{
  "apiVersion": 1,
  "dataset": {
    "id": "runtime",
    "name": "runtime"
  },
  "plugin": {
    "name": "cafe",
    "version": "0.1.0"
  },
  "capabilities": ["plot", "data", "method", "explorer", "agent"],
  "defaultTab": "plot",
  "modules": [
    { "key": "plot", "enabled": true },
    { "key": "data", "enabled": true },
    { "key": "method", "enabled": true },
    { "key": "explorer", "enabled": true },
    { "key": "agent", "enabled": false }
  ]
}
